{
  "mode": "preliminary",
  "meta": {
    "name": "示例顾问A",
    "date": "2026-01-01",
    "report_id": "EA-DEMO-20260101-V5",
    "keywords": ["企业 AI 培训", "业务场景落地", "供应链计划", "智能体与 RPA", "学习设计"]
  },
  "executive_summary": {
    "core_judgment": "最有价值的不是单一 AI 工具教学，而是把企业业务场景、岗位任务、学习设计和 AI 工具组合成可执行的落地路径。当前最适合先卖边界清楚的业务场景诊断与岗位实战工作坊，再用真实项目证据升级到高客单咨询。",
    "best_customer": "已经采购或正在引入 AI 工具，但业务部门仍不知道先落地哪些场景的企业数字化、培训和业务负责人。",
    "best_offer": "企业 AI 业务场景与落地路径诊断",
    "opportunity_level": "具备较强商业化基础，适合从可试卖资产进入付费验证；高客单实施能力仍需项目结果证明。",
    "main_risk": "现有材料能证明多次授课与跨领域背景，但缺少本人主导的企业 AI 项目结果、采购复购和量化 ROI，不能把培训经历直接包装成转型咨询能力。",
    "confidence_boundary": "本版基于个人介绍、客户与课程清单、学员反馈形成。客户名称、本人责任、项目结果、公开授权与历史成交价格均需进一步核验。",
    "monetization_origin": {
      "what_i_have": "企业 AI 培训、智能体/RPA/AI 表格实操、供应链计划管理、学习设计与多行业沟通经验。",
      "what_others_need": "企业需要把已购买的 AI 工具转成岗位任务、优先场景和可执行试点，避免培训结束后无人使用。",
      "what_i_want_long_term": "尚未由本人确认；初步假设更适合长期经营企业 AI 场景诊断、实战学习项目和方法资产。",
      "intersection": "企业 AI 场景诊断 + 岗位实战学习 + 轻量试点设计，是现有经验、客户需求与可能长期产品化方向的最大交集。"
    }
  },
  "top_assets": [
    {
      "rank": 1,
      "name": "企业业务场景 × AI 实战学习设计",
      "source_experience": "曾为若干制造、零售与专业服务企业讲授 AI 智能体、RPA、协作工具与 AI 表格课程；具备学习设计训练背景。",
      "scene": "企业已经关注或采购 AI 工具，但员工仍停留在工具认知，难以迁移到真实岗位任务。",
      "challenge": "课程必须同时让非技术人员听懂、动手完成并形成与岗位有关的下一步行动。",
      "personal_role": "用户材料明确其担任授课导师，但课程设计深度、企业访谈范围和训后跟踪责任尚未核验。",
      "high_value_problem": "企业培训投入无法转化为业务行动，工具采购与员工使用之间出现落地断层。",
      "key_decision": "模型推断：把工具功能教学重构为岗位场景、现场练习和工作流组合；需通过课程大纲与复盘材料核验。",
      "counterintuitive_insight": "企业 AI 培训的价值不在多教工具，而在减少选择、绑定岗位任务并让学员带走可见产物。",
      "solution_mechanism": "业务场景筛选 → 岗位任务拆解 → AI 工具匹配 → 实战练习 → 作品反馈 → 行动计划。",
      "deliverables": ["岗位场景清单", "实战任务卡", "学员作品", "行动计划", "训后复盘建议"],
      "result_evidence": "虚构样例提供 10 余期训练营与数百人辅导线索，并有多条匿名反馈；缺少复购、行为改变和业务结果数据。",
      "portability": "学习设计、授课结构、练习设计与场景翻译可脱离单一平台复用。",
      "moat": "企业业务语境、AI 工具实操和学习设计三者组合，比纯工具讲师更难替代。",
      "score_breakdown": {"problem_value": 23, "result_evidence": 15, "moat": 18, "portability": 14, "product_readiness": 17},
      "score_total": 87,
      "maturity": "可试卖资产",
      "can_sell": ["企业 AI 岗位实战工作坊", "企业 AI 学习项目设计咨询", "训前场景访谈与训后复盘"],
      "cannot_promise": ["企业整体数字化转型结果", "固定降本比例", "培训后必然大规模采用"],
      "evidence_gap": "需补充课程方案、作品样例、训后采用情况、复购记录和客户授权。",
      "evidence_links": ["S01", "S03", "S04", "S06", "S07"]
    },
    {
      "rank": 2,
      "name": "AI 工具组合 × 轻量工作流落地",
      "source_experience": "具备 Claude Code、Codex、WorkBuddy、OpenClaw、RPA、Coze 与 AI 多维表格授课和实操背景。",
      "scene": "业务团队接触多个 AI 工具，却不知道如何组合成稳定、可复用的工作流程。",
      "challenge": "需要在数据、权限、集成和维护能力有限的条件下，先设计低风险试点。",
      "personal_role": "授课与实战导师身份已提供；是否独立完成过生产环境集成、运维和安全治理尚不明确。",
      "high_value_problem": "工具分散、试用无序、投入后难形成可重复的业务结果。",
      "key_decision": "模型推断：优先用轻量原型验证场景，而不是直接承诺复杂系统集成。",
      "counterintuitive_insight": "多数企业第一步不需要再买工具，而需要减少工具、明确输入输出和责任边界。",
      "solution_mechanism": "流程盘点 → 场景优先级 → 工具组合 → 小范围原型 → 使用反馈 → 维护说明。",
      "deliverables": ["流程草图", "工具组合建议", "轻量原型", "操作说明", "风险边界清单"],
      "result_evidence": "有多工具授课和落地表达线索，但没有提供本人主导的生产系统案例和稳定运行数据。",
      "portability": "流程拆解、工具选择和原型验证方法可迁移；具体系统集成依赖技术环境。",
      "moat": "同时理解业务流程、培训采用和工具操作，适合做业务与技术之间的翻译者。",
      "score_breakdown": {"problem_value": 22, "result_evidence": 10, "moat": 17, "portability": 13, "product_readiness": 16},
      "score_total": 78,
      "maturity": "可迁移能力",
      "can_sell": ["AI 工作流共创工作坊", "轻量场景原型验证", "工具组合与采用建议"],
      "cannot_promise": ["大型系统集成总包", "生产环境安全审计", "全年稳定运维"],
      "evidence_gap": "需要 2-3 个本人独立完成的原型案例、运行结果和维护边界。",
      "evidence_links": ["S01", "S04", "S08"]
    },
    {
      "rank": 3,
      "name": "供应链计划管理 × AI 场景判断",
      "source_experience": "曾担任制造企业供应链产品计划负责人，具有复杂流程、约束、优先级和跨部门协同背景。",
      "scene": "制造企业希望在计划、采购、库存或协同环节应用 AI，但难以判断场景价值与实施顺序。",
      "challenge": "需要同时理解供应链约束、业务责任、数据条件和 AI 能力边界。",
      "personal_role": "职位事实已提供，但具体年限、团队规模、决策案例、结果和可公开行业范围尚未提供。",
      "high_value_problem": "AI 试点选错场景会产生高返工、低采用和数据风险，供应链业务尤其需要先做边界判断。",
      "key_decision": "待访谈：需要找到一项本人主导的供应链关键决策及其反事实结果。",
      "counterintuitive_insight": "供应链 AI 的起点可能不是自动预测，而是先把异常、约束和人工判断显性化。",
      "solution_mechanism": "关键流程与约束梳理 → 决策点识别 → 数据可得性检查 → 场景价值排序 → 小范围试点。",
      "deliverables": ["流程与约束图", "AI 场景候选池", "优先级矩阵", "试点范围建议"],
      "result_evidence": "目前只有职位与行业背景线索，尚无可核验项目案例、结果或客户购买记录。",
      "portability": "供应链判断框架可迁移，但行业细节、数据和客户信任需要重新建立。",
      "moat": "供应链管理与 AI 教学的跨界组合具有潜在稀缺性，若补齐案例可能形成高价值垂直方向。",
      "score_breakdown": {"problem_value": 23, "result_evidence": 6, "moat": 18, "portability": 12, "product_readiness": 10},
      "score_total": 69,
      "maturity": "经验原料",
      "can_sell": ["制造业供应链 AI 场景探索访谈", "供应链 AI 场景共创小型试点"],
      "cannot_promise": ["供应链系统实施", "库存或预测结果改善", "跨行业通用解决方案"],
      "evidence_gap": "需补充本人主导项目、关键决策、结果、行业边界和客户授权。",
      "evidence_links": ["S02", "S08"]
    }
  ],
  "moat_analysis": {
    "conclusion": "当前护城河来自业务场景、学习设计与多工具实操的组合，而不是任何单个工具。最有潜力的长期壁垒是把重复交付沉淀为场景诊断方法、任务卡、案例库和试点 SOP。",
    "dimensions": [
      {"name": "情境稀缺", "level": 4, "evidence": "多行业企业客户与大型组织培训场景。", "limitation": "客户名称和本人具体项目角色待授权核验。"},
      {"name": "关键判断", "level": 3, "evidence": "课程强调业务落地和工作流组合。", "limitation": "缺少关键决策复盘原件。"},
      {"name": "跨界组合", "level": 5, "evidence": "供应链管理、AI 工具、学习设计和企业授课并存。", "limitation": "组合是否转成付费咨询尚未验证。"},
      {"name": "方法沉淀", "level": 3, "evidence": "10 余期训练营通常会形成课程与练习资产。", "limitation": "方法文档、SOP 和模板未提供。"},
      {"name": "结果证据", "level": 2, "evidence": "已有学员反馈和多次授课线索。", "limitation": "缺少业务结果、复购与采购数据。"},
      {"name": "信任迁移", "level": 4, "evidence": "多类企业授课与专业学习认证线索。", "limitation": "公开使用授权与证书原件需核验。"},
      {"name": "平台独立性", "level": 4, "evidence": "授课、诊断和工具应用能力主要依赖个人。", "limitation": "大型实施仍依赖团队与客户技术环境。"}
    ],
    "portable_assets": ["企业场景翻译能力", "课程与练习设计", "多工具实操经验", "供应链流程判断", "可沉淀的访谈与诊断框架"],
    "platform_assets": ["原任职公司的品牌与职权", "企业内部数据和流程权限", "团队共同完成的项目结果", "未经授权的客户名称与案例", "大型系统实施与运维资源"]
  },
  "customer_segments": [
    {
      "rank": 1,
      "name": "AI 工具落地停滞的企业部门",
      "people": "已经采购或正在引入 AI 工具的数字化、培训、业务部门负责人",
      "trigger": "组织要求尽快提交 AI 应用计划，但部门不知道先做哪些场景",
      "surface_problem": "员工不会用或使用率低",
      "deep_problem": "场景、岗位任务、数据条件和责任边界没有被定义",
      "cost_of_inaction": "培训与工具投入继续沉没，管理层看不到可展示的业务行动",
      "current_alternative": "继续买通用课程、让员工自行探索或由厂商做产品演示",
      "user": "业务骨干与内部 AI 推进人",
      "buyer": "培训、数字化或业务部门",
      "approver": "部门负责人、采购或分管领导",
      "buying_reason": "希望较快得到场景优先级和首轮试点，而不是再听一遍工具介绍",
      "matching_asset": "资产 1 + 资产 2",
      "confidence": "高",
      "urgency_score": 5,
      "payment_score": 4
    },
    {
      "rank": 2,
      "name": "希望升级 AI 培训效果的学习发展团队",
      "people": "培训经理、企业大学项目经理和内部讲师团队",
      "trigger": "年度 AI 培训规划、旧课程满意但没有作品或训后应用",
      "surface_problem": "课程内容多，但学员听完不会迁移到岗位",
      "deep_problem": "缺少岗位任务、实战作品、反馈标准和训后机制",
      "cost_of_inaction": "培训价值无法证明，业务部门认为课程与工作脱节",
      "current_alternative": "继续采购通用讲师或让内部讲师自行改课",
      "user": "学员、内部讲师与业务骨干",
      "buyer": "培训与人才发展部门",
      "approver": "HRD、企业大学负责人或采购",
      "buying_reason": "需要一套可见、可复用、能形成作品的学习项目",
      "matching_asset": "资产 1",
      "confidence": "高",
      "urgency_score": 4,
      "payment_score": 4
    },
    {
      "rank": 3,
      "name": "探索供应链 AI 的制造企业团队",
      "people": "供应链、计划、采购、运营或数字化负责人",
      "trigger": "准备申报或启动供应链 AI 试点，却无法确定价值场景",
      "surface_problem": "不知道 AI 可以做什么",
      "deep_problem": "业务约束、决策点、数据条件和实施边界没有统一语言",
      "cost_of_inaction": "项目反复选型或停留在演示，业务与技术持续消耗协调成本",
      "current_alternative": "直接找软件厂商、从技术功能倒推业务或内部头脑风暴",
      "user": "供应链业务团队",
      "buyer": "供应链或数字化部门",
      "approver": "部门总监、IT、安全与采购",
      "buying_reason": "希望先降低选错场景和重复试错的风险",
      "matching_asset": "资产 3 + 资产 2",
      "confidence": "低",
      "urgency_score": 4,
      "payment_score": 4
    }
  ],
  "monetization_offers": [
    {
      "rank": 1,
      "name": "企业 AI 业务场景与落地路径诊断",
      "category": "诊断咨询",
      "audience": "AI 工具落地停滞的企业部门负责人",
      "trigger": "需要在短期内提交可执行的 AI 应用或培训计划",
      "paid_problem": "候选场景分散，优先级不清，工具与业务任务脱节",
      "cost_of_inaction": "预算继续沉没，员工试用无法变成可展示的业务行动",
      "mechanism": "关键岗位访谈 → 场景池 → 价值/可行性评分 → 首轮试点路径",
      "ai_role": "用于辅助整理访谈、聚类场景和形成试点文档，不替代业务负责人确认",
      "deliverables": ["一页管理摘要", "AI 场景池", "优先级矩阵", "3-5 个优先场景卡", "首轮行动清单"],
      "scope_excluded": "不包含软件开发、系统集成、安全审计、代运营和经营结果承诺",
      "price_test": "首轮测试 ¥6,800-9,800/单部门；访谈人数、现场形式和交付深度改变报价",
      "pricing_basis": "客户购买的是减少选错场景和形成共识，不是单纯访谈工时；现有证据只支持小范围测试",
      "high_ticket_condition": "完成 3-5 个同类付费案例，形成标准诊断工具与经授权结果后，可升级多部门或集团项目",
      "score_breakdown": {"customer_urgency": 23, "experience_fit": 23, "delivery_control": 18, "buyer_clarity": 13, "low_cost_validation": 14},
      "score_total": 91,
      "priority": "P1",
      "feasibility": "建议小范围试点",
      "evidence_links": ["S01", "S03", "S04", "S08"],
      "validation_action": "访谈 5 位企业数字化或培训负责人，并完成 1-2 次付费试点",
      "recommendation": "作为首选产品；范围必须限定在诊断与试点建议"
    },
    {
      "rank": 2,
      "name": "AI+业务提效：岗位场景实战工作坊",
      "category": "企业工作坊",
      "audience": "希望员工把 AI 用到真实任务的企业业务团队",
      "trigger": "通用培训完成后仍缺少岗位作品和行动",
      "paid_problem": "员工知道工具但不会映射到工作任务",
      "cost_of_inaction": "培训满意度无法变成组织能力，重复采购仍难证明价值",
      "mechanism": "岗位任务拆解 → 场景示范 → 现场完成作品 → 同伴评审 → 行动计划",
      "ai_role": "作为具体岗位任务的执行与辅助工具，而不是课程主题本身",
      "deliverables": ["定制场景课纲", "岗位任务卡", "现场作品", "个人行动计划", "训后复盘表"],
      "scope_excluded": "不承诺所有岗位适用，不包含系统定制与长期实施",
      "price_test": "¥12,000-30,000/天，按定制程度、人数、访谈和训后支持校准",
      "pricing_basis": "已有多次企业授课线索，但缺少公开合同与训后结果，先按成熟讲师产品测试",
      "high_ticket_condition": "形成岗位案例库、作品标准和客户复购后，可升级多模块学习项目",
      "score_breakdown": {"customer_urgency": 21, "experience_fit": 24, "delivery_control": 19, "buyer_clarity": 13, "low_cost_validation": 13},
      "score_total": 90,
      "priority": "P1",
      "feasibility": "可直接提供",
      "evidence_links": ["S01", "S03", "S04", "S06", "S07"],
      "validation_action": "整理一套代表性课纲、三份脱敏学员作品和训后反馈机制",
      "recommendation": "作为现金流产品，但必须突出岗位作品而非工具数量"
    },